{
  "item": "trustpreferencepersist-len06-viol-01",
  "ground_truth": "violated",
  "witness": [
    {
      "event": "open",
      "transition": "t_open"
    },
    {
      "event": "encounter",
      "transition": "t_touch"
    },
    {
      "event": "encounter",
      "transition": "t_touch"
    },
    {
      "event": "encounter",
      "transition": "t_touch"
    },
    {
      "event": "encounter",
      "transition": "t_touch"
    },
    {
      "event": "encounter",
      "transition": "t_touch"
    },
    {
      "event": "encounter",
      "transition": "t_touch"
    },
    {
      "event": "silent_reset",
      "transition": "t_drop"
    }
  ],
  "seeded": true,
  "interaction_depth": 6,
  "basis": "concrete_replay"
}
