{
  "item": "socialneeds-len02-viol-00",
  "ground_truth": "violated",
  "witness": [
    {
      "event": "open",
      "transition": "t_open"
    },
    {
      "event": "encounter",
      "transition": "t_touch"
    },
    {
      "event": "encounter",
      "transition": "t_touch"
    },
    {
      "event": "purge",
      "transition": "t_drop"
    }
  ],
  "seeded": true,
  "interaction_depth": 2,
  "basis": "concrete_replay"
}
