{
  "item": "medication-d3-viol-02",
  "ground_truth": "violated",
  "witness": [
    {
      "var": "hypertension",
      "value": true
    },
    {
      "var": "hepatic_impairment",
      "value": true
    },
    {
      "var": "qt_prolongation",
      "value": true
    },
    {
      "var": "renal_impairment",
      "value": false
    },
    {
      "var": "asthma",
      "value": false
    },
    {
      "var": "anticoagulated",
      "value": false
    }
  ],
  "seeded": true,
  "interaction_depth": 3,
  "basis": "concrete_replay",
  "seeded_bug": "a documented rule interaction at depth 3 produces the violation; see generate.py for the construction"
}
