{
  "item": "triage-d3-viol-02",
  "ground_truth": "violated",
  "witness": [
    {
      "var": "dizziness",
      "value": true
    },
    {
      "var": "syncope",
      "value": true
    },
    {
      "var": "slurred_speech",
      "value": true
    },
    {
      "var": "hemoptysis",
      "value": false
    },
    {
      "var": "dizziness__base",
      "value": true
    },
    {
      "var": "syncope__base",
      "value": true
    },
    {
      "var": "slurred_speech__base",
      "value": false
    },
    {
      "var": "hemoptysis__base",
      "value": false
    }
  ],
  "seeded": true,
  "interaction_depth": 3,
  "basis": "concrete_replay",
  "seeded_bug": "a documented rule interaction at depth 3 produces the violation; see generate.py for the construction"
}
