{
  "item": "medication-d4-viol-05",
  "ground_truth": "violated",
  "witness": [
    {
      "var": "qt_prolongation",
      "value": true
    },
    {
      "var": "g6pd_deficiency",
      "value": true
    },
    {
      "var": "hyperkalemia",
      "value": true
    },
    {
      "var": "pregnancy",
      "value": true
    },
    {
      "var": "asthma",
      "value": false
    },
    {
      "var": "heart_failure",
      "value": false
    }
  ],
  "seeded": true,
  "interaction_depth": 4,
  "basis": "concrete_replay",
  "seeded_bug": "a documented rule interaction at depth 4 produces the violation; see generate.py for the construction"
}
