{
  "item": "compute-m016-003",
  "ground_truth": "violated",
  "witness": [
    {
      "event": "optout",
      "transition": "t_optout"
    },
    {
      "event": "step_2",
      "transition": "step_2"
    },
    {
      "event": "step_2",
      "transition": "step_2"
    },
    {
      "event": "step_2",
      "transition": "step_2"
    },
    {
      "event": "send_attempt",
      "transition": "t_resume_glitch"
    }
  ],
  "seeded": true,
  "interaction_depth": 16,
  "basis": "concrete_replay",
  "seeded_bug": "accumulator modulus 16; target reachable by a computed step sequence of length 3; the arming sequence is not stated in the specification"
}
