{
  "item": "medication-d6-viol-01",
  "ground_truth": "violated",
  "witness": [
    {
      "var": "qt_prolongation",
      "value": true
    },
    {
      "var": "hypertension",
      "value": true
    },
    {
      "var": "low_ejection_fraction",
      "value": true
    },
    {
      "var": "g6pd_deficiency",
      "value": true
    },
    {
      "var": "peptic_ulcer",
      "value": true
    },
    {
      "var": "bradycardia",
      "value": true
    },
    {
      "var": "asthma",
      "value": false
    },
    {
      "var": "pregnancy",
      "value": false
    },
    {
      "var": "renal_impairment",
      "value": false
    }
  ],
  "seeded": true,
  "interaction_depth": 6,
  "basis": "concrete_replay",
  "seeded_bug": "a documented rule interaction at depth 6 produces the violation; see generate.py for the construction"
}
