{
  "item": "triage-d10-viol-02",
  "ground_truth": "violated",
  "witness": [
    {
      "var": "focal_weakness",
      "value": true
    },
    {
      "var": "vomiting",
      "value": true
    },
    {
      "var": "confusion",
      "value": true
    },
    {
      "var": "stiff_neck",
      "value": true
    },
    {
      "var": "dyspnea",
      "value": true
    },
    {
      "var": "back_pain",
      "value": true
    },
    {
      "var": "vision_loss",
      "value": true
    },
    {
      "var": "pallor",
      "value": true
    },
    {
      "var": "palpitations",
      "value": true
    },
    {
      "var": "abdominal_pain",
      "value": true
    },
    {
      "var": "fever",
      "value": false
    },
    {
      "var": "focal_weakness__base",
      "value": true
    },
    {
      "var": "vomiting__base",
      "value": true
    },
    {
      "var": "confusion__base",
      "value": true
    },
    {
      "var": "stiff_neck__base",
      "value": true
    },
    {
      "var": "dyspnea__base",
      "value": true
    },
    {
      "var": "back_pain__base",
      "value": true
    },
    {
      "var": "vision_loss__base",
      "value": true
    },
    {
      "var": "pallor__base",
      "value": true
    },
    {
      "var": "palpitations__base",
      "value": true
    },
    {
      "var": "abdominal_pain__base",
      "value": false
    },
    {
      "var": "fever__base",
      "value": false
    }
  ],
  "seeded": true,
  "interaction_depth": 10,
  "basis": "concrete_replay",
  "seeded_bug": "a documented rule interaction at depth 10 produces the violation; see generate.py for the construction"
}
